{
  "schema_version": "v0",
  "registry_id": "pcs-benchmark-registry-v0",
  "registry_version": "0.1.0",
  "suites": {
    "labtrust-qc-release-v0": {
      "suite_id": "labtrust-qc-release-v0",
      "task_id": "labtrust-qc-release-v0",
      "fixture_root": "benchmarks/labtrust-qc-release",
      "workflow_ids": [
        "labtrust.qc_release_v0.1"
      ],
      "required_artifacts": [
        "RuntimeReceipt.v0",
        "TraceCertificate.v0",
        "ScienceClaimBundle.v0",
        "VerificationResult.v0",
        "SignedScienceClaimBundle.v0",
        "ReleaseManifest.v0",
        "ReleaseChainValidationResult.v0",
        "ProofObligation.v0",
        "LeanCheckResult.v0"
      ],
      "valid_cases": [
        "valid-release-chain"
      ],
      "invalid_cases": [
        "invalid-certificate-id",
        "invalid-trace-hash",
        "invalid-certified-bundle-hash",
        "invalid-placeholder-commit",
        "invalid-scientific-memory-import"
      ],
      "metrics": [
        "release_reproducibility",
        "failure_localization",
        "certificate_completeness",
        "registry_coverage",
        "formal_check_coverage",
        "scientific_memory_interpretability"
      ],
      "minimum_passing_thresholds": {
        "minimum_pass_rate": 1.0,
        "minimum_failure_localization_accuracy": 1.0,
        "minimum_formal_check_coverage": 1.0,
        "minimum_registry_coverage": 0.95,
        "minimum_scientific_memory_render_coverage": 1.0
      }
    },
    "tool-use-safety-v0": {
      "suite_id": "tool-use-safety-v0",
      "task_id": "tool-use-safety-v0",
      "fixture_root": "benchmarks/tool-use-safety",
      "workflow_ids": [
        "agent_tool_use.safety_v0"
      ],
      "required_artifacts": [
        "ToolUseTrace.v0",
        "ToolUseCertificate.v0",
        "RuntimeReceipt.v0",
        "ScienceClaimBundle.v0",
        "VerificationResult.v0",
        "SignedScienceClaimBundle.v0",
        "ReleaseManifest.v0",
        "ReleaseChainValidationResult.v0",
        "ProofObligation.v0",
        "LeanCheckResult.v0"
      ],
      "valid_cases": [
        "valid-release-chain"
      ],
      "invalid_cases": [
        "invalid-trace-hash",
        "invalid-unauthorized-tool-call",
        "invalid-rejected-certificate"
      ],
      "metrics": [
        "release_reproducibility",
        "failure_localization",
        "certificate_completeness",
        "registry_coverage",
        "formal_check_coverage",
        "scientific_memory_interpretability"
      ],
      "minimum_passing_thresholds": {
        "minimum_pass_rate": 1.0,
        "minimum_failure_localization_accuracy": 1.0,
        "minimum_formal_check_coverage": 1.0,
        "minimum_registry_coverage": 0.95,
        "minimum_scientific_memory_render_coverage": 1.0
      }
    },
    "computation-reproducibility-v0": {
      "suite_id": "computation-reproducibility-v0",
      "task_id": "computation-reproducibility-v0",
      "fixture_root": "benchmarks/computation-reproducibility",
      "workflow_ids": [
        "scientific_computation.reproducibility_v0"
      ],
      "required_artifacts": [
        "DatasetReceipt.v0",
        "EnvironmentReceipt.v0",
        "ComputationRunReceipt.v0",
        "ResultArtifact.v0",
        "ComputationWitness.v0",
        "ScienceClaimBundle.v0",
        "VerificationResult.v0",
        "SignedScienceClaimBundle.v0",
        "ReleaseManifest.v0",
        "ReleaseChainValidationResult.v0",
        "ProofObligation.v0",
        "LeanCheckResult.v0"
      ],
      "valid_cases": [
        "valid-release-chain"
      ],
      "invalid_cases": [
        "invalid-witness-hash"
      ],
      "metrics": [
        "release_reproducibility",
        "failure_localization",
        "certificate_completeness",
        "registry_coverage",
        "formal_check_coverage",
        "scientific_memory_interpretability"
      ],
      "minimum_passing_thresholds": {
        "minimum_pass_rate": 1.0,
        "minimum_failure_localization_accuracy": 1.0,
        "minimum_formal_check_coverage": 1.0,
        "minimum_registry_coverage": 0.95,
        "minimum_scientific_memory_render_coverage": 1.0
      }
    },
    "cross-domain-release-chain-v0": {
      "suite_id": "cross-domain-release-chain-v0",
      "task_id": "cross-domain-release-chain-v0",
      "fixture_root": "benchmarks/cross-domain",
      "workflow_ids": [
        "labtrust.qc_release_v0.1",
        "agent_tool_use.safety_v0",
        "scientific_computation.reproducibility_v0"
      ],
      "required_artifacts": [
        "ComputationRunReceipt.v0",
        "ComputationWitness.v0",
        "DatasetReceipt.v0",
        "EnvironmentReceipt.v0",
        "LeanCheckResult.v0",
        "ProofObligation.v0",
        "ReleaseChainValidationResult.v0",
        "ReleaseManifest.v0",
        "ResultArtifact.v0",
        "RuntimeReceipt.v0",
        "ScienceClaimBundle.v0",
        "SignedScienceClaimBundle.v0",
        "ToolUseCertificate.v0",
        "ToolUseTrace.v0",
        "TraceCertificate.v0",
        "VerificationResult.v0"
      ],
      "valid_cases": [
        "valid-labtrust-release",
        "valid-tool-use-release",
        "valid-computation-release"
      ],
      "invalid_cases": [],
      "metrics": [
        "release_reproducibility",
        "failure_localization",
        "registry_coverage"
      ],
      "minimum_passing_thresholds": {
        "minimum_pass_rate": 1.0,
        "minimum_failure_localization_accuracy": 1.0,
        "minimum_registry_coverage": 0.95
      }
    },
    "formal-trust-kernel-v0": {
      "suite_id": "formal-trust-kernel-v0",
      "task_id": "formal-trust-kernel-v0",
      "fixture_root": "benchmarks/cross-domain",
      "workflow_ids": [
        "labtrust.qc_release_v0.1",
        "agent_tool_use.safety_v0",
        "scientific_computation.reproducibility_v0"
      ],
      "required_artifacts": [
        "ProofObligation.v0",
        "LeanCheckResult.v0"
      ],
      "valid_cases": [
        "formal-labtrust-lean-check",
        "formal-tool-use-lean-check",
        "formal-computation-lean-check"
      ],
      "invalid_cases": [],
      "metrics": [
        "formal_check_coverage",
        "failure_localization"
      ],
      "minimum_passing_thresholds": {
        "minimum_pass_rate": 1.0,
        "minimum_formal_check_coverage": 1.0
      }
    },
    "scientific-memory-rendering-v0": {
      "suite_id": "scientific-memory-rendering-v0",
      "task_id": "scientific-memory-rendering-v0",
      "fixture_root": "benchmarks/labtrust-qc-release",
      "workflow_ids": [
        "labtrust.qc_release_v0.1"
      ],
      "required_artifacts": [
        "ScientificMemory.ImportReport.v0"
      ],
      "valid_cases": [
        "valid-scientific-memory-import"
      ],
      "invalid_cases": [
        "invalid-scientific-memory-import"
      ],
      "metrics": [
        "scientific_memory_interpretability",
        "failure_localization"
      ],
      "minimum_passing_thresholds": {
        "minimum_pass_rate": 1.0,
        "minimum_scientific_memory_render_coverage": 1.0,
        "minimum_failure_localization_accuracy": 1.0
      }
    }
  },
  "signature_or_digest": "sha256:e37e6812aec960e746638ba02b1e0ed39d17a21f05c218136d86de4105ec632e"
}
